{
  "contract": "io.clayz.presentation.reference-record/1.0",
  "reference_record_id": "reference.synthetic-evidence-opening",
  "revision": "1",
  "title": "Synthetic evidence sequence opening",
  "summary": "Metadata for a synthetic opening page that establishes the decision question without storing copy, coordinates, or media.",
  "provenance": {
    "source_kind": "synthetic-only",
    "source_id": "clayz-stage4-synthetic-sequence",
    "source_revision": "1",
    "rights_status": "redistributable-metadata",
    "materialization_policy": "metadata-only",
    "never_copy": ["corporate templates", "presentation masters", "brand kits", "logos", "font files", "private data", "model weights"]
  },
  "classification": {
    "page_role": "context",
    "first_visual_role": "decision question",
    "semantic_relations": ["frames"],
    "composition_pattern_ids": ["pattern.asymmetric-evidence-to-decision"],
    "dominant_medium": "typography",
    "content_load": "low",
    "density": "low",
    "reading_path": "question to evidence expectation",
    "series_role": "opening",
    "failure_pattern_ids": ["failure.semantic-visual-mismatch"],
    "languages": ["en-US", "zh-CN"]
  },
  "neighbors": {
    "physical": ["reference.synthetic-evidence-comparison"],
    "semantic": ["reference.synthetic-evidence-decision"]
  },
  "quality": {
    "status": "synthetic-fixture",
    "human_admitted": true,
    "decision_basis": "synthetic-contract",
    "automatic_score_role": "diagnostic-only"
  },
  "content_boundary": {
    "metadata_only": true,
    "media_included": false,
    "copy_included": false,
    "coordinates_included": false,
    "fonts_included": false,
    "model_features_included": false
  }
}
